country,genre,original_title,public,score,stars,storyline,time,title,year
India,"Comedy,Drama",,PG-13,8.4,"Madhavan,Mona Singh,Aamir Khan","Two friends are searching for their long lost companion. They revisit their college days and recall the memories of their friend who inspired them to think differently, even as the rest of t...",170,3 Idiots,2009
Japan,"Animation,Action,Adventure",Mononoke-hime,PG-13,8.3,"Yuriko Ishida,Yôji Matsuda,Yûko Tanaka","On a journey to find the cure for a Tatarigami's curse, Ashitaka finds himself in the middle of a war between the forest gods and Tatara, a mining colony. In this quest he also meets San, th...",134,Princess Mononoke,1997
United States,"Action,Adventure,Drama",,PG-13,8.4,"Robert Downey Jr.,Chris Evans,Mark Ruffalo","After the devastating events of Avengers: Infinity War (2018), the universe is in ruins. With the help of remaining allies, the Avengers assemble once more in order to reverse Thanos' action...",181,Avengers: Endgame,2019
"United States,Canada","Crime,Drama,Thriller",,R,8.4,"Joaquin Phoenix,Robert De Niro,Zazie Beetz","The rise of Arthur Fleck, from aspiring stand-up comedian and pariah to Gotham's clown prince and leader of the revolution.",122,Joker,2019
"United States,Japan","Animation,Adventure,Comedy",,PG,8.4,"Gael García Bernal,Benjamin Bratt,Anthony Gonzalez","Aspiring musician Miguel, confronted with his family's ancestral ban on music, enters the Land of the Dead to find his great-great-grandfather, a legendary singer.",105,Coco,2017
United States,"Biography,Drama,History",,R,8.4,"Sophie Marceau,Mel Gibson,Patrick McGoohan",Scottish warrior William Wallace leads his countrymen in a rebellion to free his homeland from the tyranny of King Edward I of England.,178,Braveheart,1995
South Korea,"Action,Drama,Mystery",Oldeuboi,R,8.4,"Choi Min-sik,Yoo Ji-tae,Kang Hye-jeong","After being kidnapped and imprisoned for fifteen years, Oh Dae-Su is released, only to find that he must find his captor in five days.",120,Oldboy,2003
"United States,France,Italy","Biography,Drama,Music",,PG,8.4,"Tom Hulce,F. Murray Abraham,Elizabeth Berridge","The life, success and troubles of Wolfgang Amadeus Mozart, as told by Antonio Salieri, the contemporaneous composer who was deeply jealous of Mozart's talent and claimed to have murdered him...",160,Amadeus,1984
"Germany,United States","Adventure,Drama,War",,R,8.3,"Brad Pitt,Eli Roth,Diane Kruger","In Nazi-occupied France during World War II, a plan to assassinate Nazi leaders by a group of Jewish U.S. soldiers coincides with a theatre owner's vengeful plans for the same.",153,Inglourious Basterds,2009
"United States,Japan","Animation,Adventure,Comedy",,G,8.3,"Don Rickles,Tom Hanks,Tim Allen",A cowboy doll is profoundly threatened and jealous when a new spaceman action figure supplants him as top toy in a boy's bedroom.,81,Toy Story,1995
United States,Drama,,R,8.4,"Thora Birch,Kevin Spacey,Annette Bening",A sexually frustrated suburban father has a mid-life crisis after becoming infatuated with his daughter's best friend.,122,American Beauty,1999
"Canada,United States","Animation,Action,Adventure",,PG,8.4,"Jake Johnson,Hailee Steinfeld,Shameik Moore","Teen Miles Morales becomes the Spider-Man of his universe, and must join with five spider-powered individuals from other dimensions to stop a threat for all realities.",117,Spider-Man: Into the Spider-Verse,2018
United States,"Crime,Drama,Mystery",,Approved,8.4,"Marlene Dietrich,Tyrone Power,Charles Laughton",A veteran British barrister must defend his client in a murder trial that has surprise after surprise.,116,Witness for the Prosecution,1957
"United Kingdom,United States","Action,Adventure,Sci-Fi",,R,8.4,"Michael Biehn,Carrie Henn,Sigourney Weaver","Decades after surviving the Nostromo incident, Ellen Ripley is sent out to re-establish contact with a terraforming colony but finds herself battling the Alien Queen and her offspring.",137,Aliens,1986
"United Kingdom,United States","Comedy,War",,PG,8.4,"George C. Scott,Sterling Hayden,Peter Sellers","An insane American general orders a bombing attack on the Soviet Union, triggering a path to nuclear holocaust that a war room full of politicians and generals frantically tries to stop.",95,Dr. Strangelove or: How I Learned to Stop Worrying and Love the Bomb,1964
"United Kingdom,United States","Drama,Horror",,R,8.4,"Shelley Duvall,Danny Lloyd,Jack Nicholson","A family heads to an isolated hotel for the winter where a sinister presence influences the father into violence, while his psychic son sees horrific forebodings from both past and future.",146,The Shining,1980
United States,"Comedy,Drama,War",,G,8.4,"Charles Chaplin,Jack Oakie,Paulette Goddard",Dictator Adenoid Hynkel tries to expand his empire while a poor Jewish barber tries to avoid persecution from Hynkel's regime.,125,The Great Dictator,1940
United States,"Action,Adventure,Sci-Fi",,PG-13,8.4,"Robert Downey Jr.,Mark Ruffalo,Chris Hemsworth",The Avengers and their allies must be willing to sacrifice all in an attempt to defeat the powerful Thanos before his blitz of devastation and ruin puts an end to the universe.,149,Avengers: Infinity War,2018
"United States,United Kingdom","Action,Drama,Thriller",,PG-13,8.4,"Anne Hathaway,Tom Hardy,Christian Bale","Eight years after the Joker's reign of chaos, Batman is coerced out of exile with the assistance of the mysterious Selina Kyle in order to defend Gotham City from the vicious guerrilla terro...",164,The Dark Knight Rises,2012
United States,"Drama,War",,Approved,8.4,"Ralph Meeker,Adolphe Menjou,Kirk Douglas","After refusing to attack an enemy position, a general accuses the soldiers of cowardice and their commanding officer must defend them.",88,Paths of Glory,1957
"Germany,France","Drama,Mystery,Thriller",Das Leben der Anderen,R,8.4,"Ulrich Mühe,Martina Gedeck,Sebastian Koch","In 1984 East Berlin, an agent of the secret police, conducting surveillance on a writer and his lover, finds himself becoming increasingly absorbed by their lives.",137,The Lives of Others,2006
United States,"Drama,Film-Noir",,Passed,8.4,"Gloria Swanson,William Holden,Erich von Stroheim",A screenwriter develops a dangerous relationship with a faded film star determined to make a triumphant return.,110,Sunset Blvd.,1950
"United States,Japan","Animation,Adventure,Family",,G,8.4,"Ben Burtt,Elissa Knight,Jeff Garlin","In the distant future, a small waste-collecting robot inadvertently embarks on a space journey that will ultimately decide the fate of mankind.",98,WALL·E,2008
"United Kingdom,United States","Horror,Sci-Fi",,R,8.5,"Tom Skerritt,John Hurt,Sigourney Weaver",The crew of a commercial spacecraft encounter a deadly lifeform after investigating an unknown transmission.,117,Alien,1979
United States,"Action,Adventure",,PG,8.4,"Harrison Ford,Paul Freeman,Karen Allen","In 1936, archaeologist and adventurer Indiana Jones is hired by the U.S. government to find the Ark of the Covenant before the Nazis can obtain its awesome powers.",115,Raiders of the Lost Ark,1981
United States,"Mystery,Thriller",,R,8.4,"Joe Pantoliano,Guy Pearce,Carrie-Anne Moss",A man with short-term memory loss attempts to track down his wife's murderer.,113,Memento,2000
United States,"Drama,Western",,R,8.4,"Jamie Foxx,Leonardo DiCaprio,Christoph Waltz","With the help of a German bounty-hunter, a freed slave sets out to rescue his wife from a brutal plantation owner in Mississippi.",165,Django Unchained,2012
United States,"Mystery,Thriller",,PG,8.5,"Wendell Corey,James Stewart,Grace Kelly","A wheelchair-bound photographer spies on his neighbors from his Greenwich Village courtyard apartment window, and becomes convinced one of them has committed murder, despite the skepticism o...",112,Rear Window,1954
"Italy,France","Drama,Romance",Nuovo Cinema Paradiso,PG,8.5,"Enzo Cannavale,Antonella Attili,Philippe Noiret",A filmmaker recalls his childhood when falling in love with the pictures at the cinema of his home village and forms a deep friendship with the cinema's projectionist.,155,Cinema Paradiso,1988
United States,"Comedy,Drama,Romance",,G,8.5,"Virginia Cherrill,Charles Chaplin,Florence Lee","With the aid of a wealthy erratic tippler, a dewy-eyed tramp who has fallen in love with a sightless flower girl accumulates money to be able to help her medically.",87,City Lights,1931
"Italy,United States",Western,C'era una volta il West,PG-13,8.5,"Claudia Cardinale,Henry Fonda,Charles Bronson",A mysterious stranger with a harmonica joins forces with a notorious desperado to protect a beautiful widow from a ruthless assassin working for the railroad.,165,Once Upon a Time in the West,1968
United States,"Drama,Mystery,War",,R,8.5,"Martin Sheen,Marlon Brando,Robert Duvall",A U.S. Army officer serving in Vietnam is tasked with assassinating a renegade Special Forces Colonel who sees himself as a god.,147,Apocalypse Now,1979
Japan,"Action,Drama,Mystery",Seppuku,Not Rated,8.6,"Tatsuya Nakadai,Akira Ishihama,Shima Iwashita","When a ronin requesting seppuku at a feudal lord's palace is told of the brutal suicide of another ronin who previously visited, he reveals how their pasts are intertwined - and in doing so ...",133,Harakiri,1962
United States,"Comedy,Drama,Romance",,G,8.5,"Charles Chaplin,Henry Bergman,Paulette Goddard",The Tramp struggles to live in modern industrial society with the help of a young homeless woman.,87,Modern Times,1936
France,"Biography,Comedy,Drama",Intouchables,R,8.5,"François Cluzet,Anne Le Ny,Omar Sy","After he becomes a quadriplegic from a paragliding accident, an aristocrat hires a young man from the projects to be his caregiver.",112,The Intouchables,2011
United States,"Drama,Romance,War",,PG,8.5,"Ingrid Bergman,Humphrey Bogart,Paul Henreid",A cynical expatriate American cafe owner struggles to decide whether or not to help his former lover and her fugitive husband escape the Nazis in French Morocco.,102,Casablanca,1942
Japan,"Animation,Drama,War",Hotaru no haka,Not Rated,8.5,"Ayano Shiraishi,Akemi Yamaguchi,Tsutomu Tatsumi",A young boy and his little sister struggle to survive in Japan during World War II.,89,Grave of the Fireflies,1988
United States,"Drama,Music",,R,8.5,"J.K. Simmons,Melissa Benoist,Miles Teller",A promising young drummer enrolls at a cut-throat music conservatory where his dreams of greatness are mentored by an instructor who will stop at nothing to realize a student's potential.,106,Whiplash,2014
United States,"Crime,Drama",,R,8.5,"Beverly D'Angelo,Edward Furlong,Edward Norton",A former neo-nazi skinhead tries to prevent his younger brother from going down the same wrong path that he did.,119,American History X,1998
"United States,Hong Kong","Crime,Drama,Thriller",,R,8.5,"Matt Damon,Leonardo DiCaprio,Jack Nicholson",An undercover cop and a mole in the police attempt to identify each other while infiltrating an Irish gang in South Boston.,151,The Departed,2006
"United States,Germany","Crime,Drama,Mystery",,R,8.5,"Gabriel Byrne,Kevin Spacey,Chazz Palminteri","A sole survivor tells of the twisty events leading up to a horrific gun battle on a boat, which began when five criminals met at a seemingly random police lineup.",106,The Usual Suspects,1995
"United Kingdom,United States","Drama,Mystery,Sci-Fi",,PG-13,8.5,"Scarlett Johansson,Christian Bale,Hugh Jackman","After a tragic accident, two stage magicians in 1890s London engage in a battle to create the ultimate illusion while sacrificing everything they have to outwit each other.",130,The Prestige,2006
"United States,United Kingdom,Malta,Morocco","Action,Adventure,Drama",,R,8.5,"Connie Nielsen,Joaquin Phoenix,Russell Crowe",A former Roman General sets out to exact vengeance against the corrupt emperor who murdered his family and sent him into slavery.,155,Gladiator,2000
United States,"Animation,Adventure,Drama",,G,8.5,"Jeremy Irons,James Earl Jones,Matthew Broderick","Lion prince Simba and his father are targeted by his bitter uncle, who wants to ascend the throne himself.",88,The Lion King,1994
United States,"Horror,Mystery,Thriller",,R,8.5,"Anthony Perkins,Janet Leigh,Vera Miles","A Phoenix secretary embezzles $40,000 from her employer's client, goes on the run and checks into a remote motel run by a young man under the domination of his mother.",109,Psycho,1960
"France,United States","Action,Crime,Drama",Léon,R,8.5,"Jean Reno,Natalie Portman,Gary Oldman","12-year-old Mathilda is reluctantly taken in by Léon, a professional assassin, after her family is murdered. An unusual relationship forms as she becomes his protégée and learns the assassin...",110,Léon: The Professional,1994
South Korea,"Drama,Thriller",Gisaengchung,R,8.5,"Lee Sun-kyun,Song Kang-ho,Cho Yeo-jeong",Greed and class discrimination threaten the newly formed symbiotic relationship between the wealthy Park family and the destitute Kim clan.,132,Parasite,2019
"France,Poland,Germany,United Kingdom","Biography,Drama,Music",,R,8.5,"Thomas Kretschmann,Frank Finlay,Adrien Brody",A Polish Jewish musician struggles to survive the destruction of the Warsaw ghetto of World War II.,150,The Pianist,2002
United States,"Adventure,Comedy,Sci-Fi",,PG,8.5,"Lea Thompson,Christopher Lloyd,Michael J. Fox","Marty McFly, a 17-year-old high school student, is accidentally sent 30 years into the past in a time-traveling DeLorean invented by his close friend, the maverick scientist Doc Brown.",116,Back to the Future,1985
United States,"Action,Sci-Fi",,R,8.6,"Arnold Schwarzenegger,Linda Hamilton,Edward Furlong","A cyborg, identical to the one who failed to kill Sarah Connor, must now protect her 10-year old son John from an even more advanced and powerful cyborg.",137,Terminator 2: Judgment Day,1991
Japan,"Animation,Adventure,Family",Sen to Chihiro no kamikakushi,PG,8.6,"Daveigh Chase,Suzanne Pleshette,Miyu Irino","During her family's move to the suburbs, a sullen 10-year-old girl wanders into a world ruled by gods, witches and spirits, a world where humans are changed into beasts.",125,Spirited Away,2001
Italy,"Comedy,Drama,Romance",La vita è bella,PG-13,8.6,"Roberto Benigni,Nicoletta Braschi,Giorgio Cantarini","When an open-minded Jewish waiter and his son become victims of the Holocaust, he uses a perfect mixture of will, humor and imagination to protect his son from the dangers around their camp.",116,Life Is Beautiful,1997
United States,"Crime,Drama,Fantasy",,R,8.6,"David Morse,Tom Hanks,Michael Clarke Duncan","The lives of guards on Death Row are affected by one of their charges: a black man accused of child murder and rape, yet who has a mysterious gift.",189,The Green Mile,1999
United States,"Action,Adventure,Fantasy",Star Wars,PG,8.6,"Harrison Ford,Carrie Fisher,Mark Hamill","Luke Skywalker joins forces with a Jedi Knight, a cocky pilot, a Wookiee and two droids to save the galaxy from the Empire's world-destroying battle station, while also attempting to rescue ...",121,Star Wars: Episode IV - A New Hope,1977
"Brazil,France,Germany","Crime,Drama",Cidade de Deus,R,8.6,"Alexandre Rodrigues,Matheus Nachtergaele,Leandro Firmino","In the slums of Rio, two kids' paths diverge as one struggles to become a photographer and the other a kingpin.",130,City of God,2002
United States,"Drama,War",,R,8.6,"Matt Damon,Tom Sizemore,Tom Hanks","Following the Normandy Landings, a group of U.S. soldiers go behind enemy lines to retrieve a paratrooper whose brothers have been killed in action.",169,Saving Private Ryan,1998
Japan,"Action,Drama",Shichinin no samurai,Not Rated,8.6,"Takashi Shimura,Toshirô Mifune,Keiko Tsushima","Farmers from a village exploited by bandits hire a veteran samurai for protection, who gathers six other samurai to join him.",207,Seven Samurai,1954
United States,"Drama,Family,Fantasy",,PG,8.6,"James Stewart,Lionel Barrymore,Donna Reed",An angel is sent from Heaven to help a desperately frustrated businessman by showing him what life would have been like if he had never existed.,130,It's a Wonderful Life,1946
"United States,United Kingdom,Canada","Adventure,Drama,Sci-Fi",,PG-13,8.6,"Anne Hathaway,Matthew McConaughey,Jessica Chastain",A team of explorers travel through a wormhole in space in an attempt to ensure humanity's survival.,169,Interstellar,2014
United States,Drama,,R,8.7,"Louise Fletcher,Jack Nicholson,Michael Berryman","In the Fall of 1963, a Korean War veteran and criminal pleads insanity and is admitted to a mental institution, where he rallies up the scared patients against the tyrannical nurse.",133,One Flew Over the Cuckoo's Nest,1975
United States,"Crime,Drama,Thriller",,R,8.6,"Lawrence A. Bonney,Jodie Foster,Anthony Hopkins","A young F.B.I. cadet must receive the help of an incarcerated and manipulative cannibal killer to help catch another serial killer, a madman who skins his victims.",118,The Silence of the Lambs,1991
United States,"Crime,Drama,Mystery",,R,8.6,"Brad Pitt,Morgan Freeman,Kevin Spacey","Two detectives, a rookie and a veteran, hunt a serial killer who uses the seven deadly sins as his motives.",127,Se7en,1995
United States,"Biography,Crime,Drama",GoodFellas,R,8.7,"Joe Pesci,Robert De Niro,Ray Liotta","The story of Henry Hill and his life in the mob, covering his relationship with his wife Karen Hill and his mob partners Jimmy Conway and Tommy DeVito in the Italian-American crime syndicate...",145,Goodfellas,1990
